{
  "$contract": "soter://contracts/lock/v1",
  "contractVersion": "1.0.0",
  "configuration": {
    "name": "contact-capture",
    "path": "soter/configurations/contact-capture.config.json",
    "fingerprint": "sha256:2bb5354c50aa14f5d1549ca449eaf89205f4070007d3bec2da06e50e229963c6",
    "hostSelection": {
      "id": "codex",
      "source": "configuration"
    }
  },
  "resolver": {
    "id": "core.resolver",
    "version": "0.5.0"
  },
  "host": {
    "id": "codex",
    "adapter": "host.codex",
    "version": "0.3.1",
    "manifestFingerprint": "sha256:845e7cecf13f9865f967d3078176bb0d4f0565b18506484b10499d5f60a26621",
    "projectionDefinition": {
      "id": "host-projection.codex",
      "version": "0.3.0",
      "path": "soter/hosts/codex/projection.json",
      "fingerprint": "sha256:09fe78fb567ec40ac12e71e1bd5304f44246669a23fe8ac84c5eef755cb95727"
    },
    "projectionGenerator": {
      "id": "core.host-projection-generator",
      "version": "2.1.0"
    }
  },
  "packs": [
    {
      "id": "kernel.soter",
      "version": "0.1.0",
      "layer": "kernel",
      "releaseStage": "experimental",
      "evidenceMaturity": "declared",
      "source": "base",
      "reason": "Required kernel foundation: Governs how Soter systems are defined, validated, evaluated, changed, versioned, and packaged.",
      "manifestFingerprint": "sha256:a329fb60fdd3e46a9cdce1b0f6d5ea574812105be6bd235eb998a347c3339bfa",
      "artifacts": [
        {
          "path": "soter/contracts/approval-consumption.schema.json",
          "role": "definition",
          "fingerprint": "sha256:958c57bfd423b84a1e52cea83381041e9c76148bf40226206e3a0b1b03741622"
        },
        {
          "path": "soter/contracts/approval-request.schema.json",
          "role": "definition",
          "fingerprint": "sha256:c9112b2ad033cc33a9e87e66155d0702bde1b973ddd52e0633fcb580a60e894b"
        },
        {
          "path": "soter/contracts/approval-v2.schema.json",
          "role": "definition",
          "fingerprint": "sha256:feae91914e78e6e4b4fc49e673c8bc7552dbe26ee90183510f73195c8f7036db"
        },
        {
          "path": "soter/contracts/automation-decision.schema.json",
          "role": "definition",
          "fingerprint": "sha256:334b911e00786ad82aa7b6dcb11c9bd800b85b37fc0c89b97017d0d8a40b4c35"
        },
        {
          "path": "soter/contracts/automation-derived-review.schema.json",
          "role": "definition",
          "fingerprint": "sha256:884e75499af499c9ffbadac6d0f7a9b8218221019630fdee55327c2906c46204"
        },
        {
          "path": "soter/contracts/automation-input.schema.json",
          "role": "definition",
          "fingerprint": "sha256:8d19534fca778429baa6711feaafdda529e2c0ff10537e5bc69a13c4214d31de"
        },
        {
          "path": "soter/contracts/automation-proposal-material.schema.json",
          "role": "definition",
          "fingerprint": "sha256:5b741699c01f316b5d61a650fd61c67a0acde4b79108d73da0aee89cc56914bb"
        },
        {
          "path": "soter/contracts/automation-proposal.schema.json",
          "role": "definition",
          "fingerprint": "sha256:a8718190ce316e75ecc60ee6e55552473cce4f9a6430170d27372d0376548b28"
        },
        {
          "path": "soter/contracts/automation-review.schema.json",
          "role": "definition",
          "fingerprint": "sha256:4e7d4762d290723eb68ca112142615a6406f0c5bbb1fc8134de2fd9c3860f853"
        },
        {
          "path": "soter/contracts/bundle-inspection.schema.json",
          "role": "definition",
          "fingerprint": "sha256:29dc465ab445b9a16e8269c7c66511f2d6271f51df0d1b0287d8932af66318db"
        },
        {
          "path": "soter/contracts/bundle.schema.json",
          "role": "definition",
          "fingerprint": "sha256:990f5160fb7f3013fa46279daeac8f5e6c5b24d4d225d8c8d9801adbfd90b2d3"
        },
        {
          "path": "soter/contracts/capability-provider.schema.json",
          "role": "definition",
          "fingerprint": "sha256:4a2c1baaff854b870d90f6a875fca4928fb9b8746485cca6e0b4045b9020dabd"
        },
        {
          "path": "soter/contracts/capability.schema.json",
          "role": "definition",
          "fingerprint": "sha256:5c91ac8b02b6f66c75e61cb6440d771f9976fea8430d259df5d964f8a6963e5e"
        },
        {
          "path": "soter/contracts/configuration-change-confirmation.schema.json",
          "role": "definition",
          "fingerprint": "sha256:ecbaf017973732dcf0421108e054483e095d8cfcb45f82170bdc7b8b7182751c"
        },
        {
          "path": "soter/contracts/configuration-change-consumption.schema.json",
          "role": "definition",
          "fingerprint": "sha256:3e97509e3d6708f4cd6af513a850cb2b7d6413ae567541707a74163e74316197"
        },
        {
          "path": "soter/contracts/configuration-change-inspection.schema.json",
          "role": "definition",
          "fingerprint": "sha256:b0906d8d70550220eed6f244853f8dbcfb5bd91d732f4cd47b7b103d4e37a80d"
        },
        {
          "path": "soter/contracts/configuration-change-plan.schema.json",
          "role": "definition",
          "fingerprint": "sha256:37444217692c06eed72bfad5fe1bc13b52679616bb0b9afa543ab0d861b23d7c"
        },
        {
          "path": "soter/contracts/configuration-change-request.schema.json",
          "role": "definition",
          "fingerprint": "sha256:d30aa296147b639b11c9c34cbd171fd29373eedae9c99870cb40398f99a5c147"
        },
        {
          "path": "soter/contracts/configuration-preview.schema.json",
          "role": "definition",
          "fingerprint": "sha256:1b654b80e2fdd96dad55335e01de4c7a8dc1646803fbf53c4b75f1b35e3fbaad"
        },
        {
          "path": "soter/contracts/configuration-transaction-checkpoint.schema.json",
          "role": "definition",
          "fingerprint": "sha256:12e0ba3dd1003288a5fd2357ad7f2d469774755f2f80b1480253d824f357c606"
        },
        {
          "path": "soter/contracts/configuration-view.schema.json",
          "role": "definition",
          "fingerprint": "sha256:6f3a5f99369c36d0fe26b470357d19c63010648eda309bea90746ac1b0fb5bbf"
        },
        {
          "path": "soter/contracts/configuration.schema.json",
          "role": "definition",
          "fingerprint": "sha256:2b1a002e906c795f64376cf6f1eb06bf0df93500964e5c70dd62c2e6002f5a3e"
        },
        {
          "path": "soter/contracts/connected-approval-review-material.schema.json",
          "role": "definition",
          "fingerprint": "sha256:a83dd69d64eb7372c606a43badc36e89e6d492ae2742522413cf77b26acccfab"
        },
        {
          "path": "soter/contracts/connected-change-set-v2.schema.json",
          "role": "definition",
          "fingerprint": "sha256:4d5c48bdb2fc065dbbb5481b9d6ec835d2f5f29536aa13d103a3654215dab332"
        },
        {
          "path": "soter/contracts/connected-operation-batch-v2.schema.json",
          "role": "definition",
          "fingerprint": "sha256:b649d0038ee11a24ebfc05594d87d38eed0721c10bace21661438ccc3fc07f70"
        },
        {
          "path": "soter/contracts/connected-transaction-checkpoint-v2.schema.json",
          "role": "definition",
          "fingerprint": "sha256:45452492430e2720d7817871b45517c9831dbfb3104b4b93c5ed86c3358f1ae3"
        },
        {
          "path": "soter/contracts/context-record-model.schema.json",
          "role": "definition",
          "fingerprint": "sha256:cd3f197a0d7090af3f87300eb2c0cd20ed3e757972e1fbbc5795c0695bb076cb"
        },
        {
          "path": "soter/contracts/context-snapshot.schema.json",
          "role": "definition",
          "fingerprint": "sha256:19d0f7e29a2d471f4998c39d986aa4f2c96555ca57184073ab5c8b85e597df1b"
        },
        {
          "path": "soter/contracts/context-vocabulary.schema.json",
          "role": "definition",
          "fingerprint": "sha256:ba40fb4c5508713175f34aaa6b47311c9e05ae6dae4c2433dc66d369d59818d4"
        },
        {
          "path": "soter/contracts/development-governance.schema.json",
          "role": "definition",
          "fingerprint": "sha256:b19a3dbd760ef7d8748aad4d0c21262cf79a2193bebea84f1e6f1a97d32a2fca"
        },
        {
          "path": "soter/contracts/development-host-execution.schema.json",
          "role": "definition",
          "fingerprint": "sha256:004dcc04a74c6e9ba427cef0080b462d99e81cb4367b9a175368d00afb6eec12"
        },
        {
          "path": "soter/contracts/development-host-judgment.schema.json",
          "role": "definition",
          "fingerprint": "sha256:5db10625caa95659734c2718e3294e7c09679db752a25d8326d09f45740ce106"
        },
        {
          "path": "soter/contracts/development-host-observation.schema.json",
          "role": "definition",
          "fingerprint": "sha256:5bd5c15281285fff4459bff1942f7c9d1556831b2135a045e89e2f36fcdea30c"
        },
        {
          "path": "soter/contracts/development-request.schema.json",
          "role": "definition",
          "fingerprint": "sha256:6fed9974614bb8dad2a795bb00a12251d23df6415ac5d1ec69db42f16035b5ab"
        },
        {
          "path": "soter/contracts/development-result.schema.json",
          "role": "definition",
          "fingerprint": "sha256:4614bc2943669da54d0349469e706a5e9f57d6546b264f7e7e9bca002829d19d"
        },
        {
          "path": "soter/contracts/development-run-inspection.schema.json",
          "role": "definition",
          "fingerprint": "sha256:215fb3673cb1fef488e2351a4b0862e6a889a8e4926df70ad63d4304f61d48e6"
        },
        {
          "path": "soter/contracts/doctor-result.schema.json",
          "role": "definition",
          "fingerprint": "sha256:c300c610c6db2a848b9dc1b2b39d72c99a3f7dcef086299d1def222ec70c275d"
        },
        {
          "path": "soter/contracts/email-context-model.schema.json",
          "role": "definition",
          "fingerprint": "sha256:b5ab0e7dd44c216c5735f9b576c230e8e6f27df228688780e28869a552a0c65b"
        },
        {